{
  "responsible_principal_record": {
    "dcp_version": "1.0",
    "human_id": "did:human:alice123",
    "legal_name": "Alice Example",
    "entity_type": "natural_person",
    "jurisdiction": "US",
    "liability_mode": "owner_responsible",
    "override_rights": true,
    "issued_at": "2026-01-01T00:00:00Z",
    "expires_at": null,
    "signature": "A9mOZnREgjvDXZ5fazUOxMuLmqSHIqxva6IZHYndKKyF31JBTDAnLJtd4R5VMf+Mx3unlm3FV7Pts6A3mhWFBA=="
  },
  "agent_passport": {
    "dcp_version": "1.0",
    "agent_id": "did:agent:agent123",
    "public_key": "ywFRKbf3N5DA6UetOjCjfGBNyOSuXtr0THTqRA9V0+g=",
    "principal_binding_reference": "did:human:alice123",
    "capabilities": [
      "browse",
      "email",
      "api_call"
    ],
    "risk_tier": "medium",
    "created_at": "2026-01-01T00:10:00Z",
    "status": "active",
    "signature": "1S/uJm+yLpPSOdd+sEXt5MlBuYZvqr5SKQnhNWzEbpkfLqXGWklScblEpkKAjpxCeWVm/2Kc/C+PIzmbo4hTAQ=="
  },
  "intent": {
    "dcp_version": "1.0",
    "intent_id": "intent001",
    "agent_id": "did:agent:agent123",
    "human_id": "did:human:alice123",
    "timestamp": "2026-01-01T01:00:00Z",
    "action_type": "send_email",
    "target": {
      "channel": "email",
      "to": "bob@example.com"
    },
    "data_classes": [
      "contact_info"
    ],
    "estimated_impact": "medium",
    "requires_consent": false
  },
  "policy_decision": {
    "dcp_version": "1.0",
    "intent_id": "intent001",
    "decision": "approve",
    "risk_score": 0.21,
    "reasons": [
      "low_risk"
    ]
  },
  "audit_entries": [
    {
      "dcp_version": "1.0",
      "audit_id": "audit001",
      "prev_hash": "GENESIS",
      "timestamp": "2026-01-01T01:01:00Z",
      "agent_id": "did:agent:agent123",
      "human_id": "did:human:alice123",
      "intent_id": "intent001",
      "intent_hash": "6f6acc1f4cfe6fdaf925bb28f70d2b218aabf0cd3485747dcb55702f4bf6e454",
      "policy_decision": "approved",
      "outcome": "policy_approved",
      "evidence": {
        "tool": "policy_engine",
        "result_ref": null
      }
    },
    {
      "dcp_version": "1.0",
      "audit_id": "audit002",
      "prev_hash": "c38c1981665e57883e11376fea5f6f8dcc8bc6e5784fb7995c844e9f7b02e0ab",
      "timestamp": "2026-01-01T01:02:00Z",
      "agent_id": "did:agent:agent123",
      "human_id": "did:human:alice123",
      "intent_id": "intent001",
      "intent_hash": "6f6acc1f4cfe6fdaf925bb28f70d2b218aabf0cd3485747dcb55702f4bf6e454",
      "policy_decision": "approved",
      "outcome": "email_sent",
      "evidence": {
        "tool": "smtp",
        "result_ref": "msg-7788"
      }
    }
  ]
}